{
  "asset_id": "ASSET-FC-001",
  "asset_type": "flood_control",
  "name": "River Revetment - Right Bank (Station 5+200 to 5+375)",
  "description": "Bank protection and slope stabilization works along river section",
  "chainage_start_m": 5200,
  "chainage_end_m": 5375,
  "length_m": 175,
  "location": {
    "lat": 14.5988,
    "lng": 120.9831
  },
  "project_id": "PROJ-003",
  "work_items": [
    {
      "work_item_id": "WI-RIP-01",
      "work_type": "Riprap Placement",
      "item_code": "701",
      "unit": "m3",
      "target_total": 850,
      "cumulative": 210,
      "remaining": 640,
      "status": "in_progress",
      "priority": "critical",
      "notes": "Class A riprap, 300-500mm size, geotextile underlayer"
    },
    {
      "work_item_id": "WI-GB-01",
      "work_type": "Gabion Wall Construction",
      "item_code": "702",
      "unit": "m2",
      "target_total": 280,
      "cumulative": 65,
      "remaining": 215,
      "status": "in_progress",
      "priority": "high",
      "notes": "1m x 1m x 3m gabion baskets, wire mesh reinforcement"
    },
    {
      "work_item_id": "WI-PLT-01",
      "work_type": "Vegetative Planting",
      "item_code": "703",
      "unit": "pcs",
      "target_total": 500,
      "cumulative": 0,
      "remaining": 500,
      "status": "pending",
      "priority": "medium",
      "notes": "River bamboo and vetiver grass for slope stabilization"
    },
    {
      "work_item_id": "WI-DRAIN-01",
      "work_type": "Subsurface Drainage",
      "item_code": "704",
      "unit": "lm",
      "target_total": 175,
      "cumulative": 30,
      "remaining": 145,
      "status": "in_progress",
      "priority": "medium",
      "notes": "150mm perforated PVC pipe with gravel filter"
    },
    {
      "work_item_id": "WI-SOD-01",
      "work_type": "Sodding and Turfing",
      "item_code": "705",
      "unit": "m2",
      "target_total": 420,
      "cumulative": 0,
      "remaining": 420,
      "status": "pending",
      "priority": "low",
      "notes": "Carabao grass sodding on top slope"
    }
  ],
  "created_at": "2025-01-15T09:00:00Z",
  "updated_at": "2025-01-27T16:45:00Z"
}