{
  "asset_id": "ASSET-RD-001",
  "asset_type": "road_section",
  "name": "National Highway - Right Lane (0+000 to 0+100)",
  "description": "Right lane pavement construction with drainage improvements",
  "chainage_start_m": 0,
  "chainage_end_m": 100,
  "side": "right",
  "length_m": 100,
  "width_m": 3.5,
  "location": {
    "lat": 14.5995,
    "lng": 120.9842
  },
  "project_id": "PROJ-001",
  "work_items": [
    {
      "work_item_id": "WI-311-01",
      "work_type": "PCCP (Concrete Pavement)",
      "item_code": "311",
      "unit": "blocks",
      "target_total": 22,
      "cumulative": 4.5,
      "remaining": 17.5,
      "status": "in_progress",
      "priority": "high",
      "notes": "4.5m block length, 350mm thickness"
    },
    {
      "work_item_id": "WI-208-01",
      "work_type": "Base Course",
      "item_code": "208",
      "unit": "m3",
      "target_total": 350,
      "cumulative": 75,
      "remaining": 275,
      "status": "in_progress",
      "priority": "high",
      "notes": "250mm crushed aggregate base"
    },
    {
      "work_item_id": "WI-501-01",
      "work_type": "Subgrade Preparation",
      "item_code": "501",
      "unit": "lm",
      "target_total": 100,
      "cumulative": 30,
      "remaining": 70,
      "status": "in_progress",
      "priority": "medium",
      "notes": "Compacted to 95% Proctor density"
    },
    {
      "work_item_id": "WI-701-01",
      "work_type": "Shoulder Construction",
      "item_code": "701",
      "unit": "lm",
      "target_total": 100,
      "cumulative": 0,
      "remaining": 100,
      "status": "pending",
      "priority": "low",
      "notes": "1.5m granular shoulder"
    }
  ],
  "created_at": "2025-01-27T08:00:00Z",
  "updated_at": "2025-01-27T14:30:00Z"
}